{
  "schema_version": "1",
  "artifact_type": "functional-set",
  "functional_set": {
    "order": 0,
    "id": "FS0-CORE",
    "kind": "core",
    "title": "FS0-Core",
    "description": "Irreducible standalone self-hosting repo-spec core. FS0-Core implements only the runtime capabilities required to consume selected Design, load one functionality-defined functional set and closed modular Plan, represent stable normative identities and applicability, execute bounded Build work against an accepted predecessor, perform basic Conformance and governed semantic Assurance, record explicit non-circular acceptance with minimum lineage, and govern the next functionality-defined functional-set cycle."
  },
  "accepted_predecessor": {
    "repository_revision": "65b6477dc3ed10cd6ebb83e83653e995f63b47fd"
  },
  "design_inputs": [
    {
      "doc_id": "DP-001",
      "path": "repo/proposals/design-proposal.md",
      "revision": "323a51777f6dabd97f0ff23e53f38acdb11abb02",
      "statements": [
        "DP001-REQUIREMENTS-001",
        "DP001-REQUIREMENTS-002",
        "DP001-REQUIREMENTS-008",
        "DP001-REQUIREMENTS-010",
        "DP001-REQUIREMENTS-011",
        "DP001-REQUIREMENTS-012",
        "DP001-REQUIREMENTS-013",
        "DP001-REQUIREMENTS-014",
        "DP001-REQUIREMENTS-015",
        "DP001-REQUIREMENTS-016",
        "DP001-REQUIREMENTS-017",
        "DP001-REQUIREMENTS-018",
        "DP001-REQUIREMENTS-019",
        "DP001-REQUIREMENTS-025",
        "DP001-REQUIREMENTS-026",
        "DP001-ARCHITECTURE-002",
        "DP001-INTERFACES-002",
        "DP001-INTERFACES-003",
        "DP001-INTERFACES-004",
        "DP001-INVARIANTS-001",
        "DP001-INVARIANTS-002",
        "DP001-INVARIANTS-003",
        "DP001-INVARIANTS-004",
        "DP001-DETAIL-001",
        "DP001-DETAIL-005",
        "DP001-DETAIL-006",
        "DP001-DETAIL-007"
      ]
    },
    {
      "doc_id": "DP-010",
      "path": "repo/proposals/framework-contract.md",
      "revision": "65b6477dc3ed10cd6ebb83e83653e995f63b47fd",
      "statements": [
        "DP010-DETAIL-083",
        "DP010-DETAIL-084",
        "DP010-DETAIL-085",
        "DP010-DETAIL-086",
        "DP010-DETAIL-087",
        "DP010-DETAIL-088",
        "DP010-DETAIL-089",
        "DP010-DETAIL-090",
        "DP010-DETAIL-091",
        "DP010-DETAIL-093",
        "DP010-DETAIL-095",
        "DP010-DETAIL-096",
        "DP010-DETAIL-097",
        "DP010-DETAIL-099"
      ]
    },
    {
      "doc_id": "DP-020",
      "path": "repo/proposals/governance.md",
      "revision": "323a51777f6dabd97f0ff23e53f38acdb11abb02",
      "statements": [
        "DP020-DETAIL-010",
        "DP020-DETAIL-011",
        "DP020-DETAIL-012",
        "DP020-DETAIL-013",
        "DP020-DETAIL-014",
        "DP020-DETAIL-015",
        "DP020-DETAIL-016",
        "DP020-DETAIL-017",
        "DP020-DETAIL-018",
        "DP020-DETAIL-019",
        "DP020-DETAIL-020",
        "DP020-DETAIL-021",
        "DP020-DETAIL-022",
        "DP020-DETAIL-023",
        "DP020-DETAIL-024",
        "DP020-DETAIL-025",
        "DP020-DETAIL-026",
        "DP020-DETAIL-027",
        "DP020-DETAIL-028",
        "DP020-DETAIL-029",
        "DP020-DETAIL-030",
        "DP020-DETAIL-031",
        "DP020-DETAIL-032",
        "DP020-DETAIL-033",
        "DP020-DETAIL-034",
        "DP020-DETAIL-035",
        "DP020-DETAIL-036",
        "DP020-DETAIL-037",
        "DP020-DETAIL-038",
        "DP020-DETAIL-039",
        "DP020-DETAIL-052",
        "DP020-DETAIL-053",
        "DP020-DETAIL-054",
        "DP020-DETAIL-055",
        "DP020-DETAIL-056",
        "DP020-DETAIL-057",
        "DP020-DETAIL-061",
        "DP020-DETAIL-062",
        "DP020-DETAIL-063",
        "DP020-DETAIL-064",
        "DP020-DETAIL-065",
        "DP020-DETAIL-066",
        "DP020-DETAIL-067",
        "DP020-DETAIL-068",
        "DP020-DETAIL-069",
        "DP020-DETAIL-070",
        "DP020-DETAIL-071",
        "DP020-DETAIL-072",
        "DP020-DETAIL-073",
        "DP020-DETAIL-074",
        "DP020-DETAIL-075",
        "DP020-DETAIL-076",
        "DP020-DETAIL-077",
        "DP020-DETAIL-078",
        "DP020-DETAIL-079",
        "DP020-DETAIL-080",
        "DP020-DETAIL-081",
        "DP020-DETAIL-082",
        "DP020-DETAIL-083",
        "DP020-DETAIL-084",
        "DP020-DETAIL-085",
        "DP020-DETAIL-086",
        "DP020-DETAIL-087",
        "DP020-DETAIL-088",
        "DP020-DETAIL-089",
        "DP020-DETAIL-090",
        "DP020-DETAIL-091",
        "DP020-DETAIL-092",
        "DP020-DETAIL-093",
        "DP020-DETAIL-094",
        "DP020-DETAIL-095",
        "DP020-DETAIL-096",
        "DP020-DETAIL-097",
        "DP020-DETAIL-103",
        "DP020-DETAIL-104",
        "DP020-DETAIL-105",
        "DP020-DETAIL-106",
        "DP020-DETAIL-107",
        "DP020-DETAIL-110",
        "DP020-DETAIL-111",
        "DP020-DETAIL-112",
        "DP020-DETAIL-113",
        "DP020-DETAIL-114",
        "DP020-DETAIL-156",
        "DP020-DETAIL-157",
        "DP020-DETAIL-165",
        "DP020-DETAIL-166",
        "DP020-DETAIL-167",
        "DP020-DETAIL-168",
        "DP020-DETAIL-169",
        "DP020-DETAIL-170",
        "DP020-DETAIL-171",
        "DP020-DETAIL-172",
        "DP020-DETAIL-173",
        "DP020-DETAIL-174",
        "DP020-DETAIL-175"
      ]
    },
    {
      "doc_id": "DP-030",
      "path": "repo/proposals/conformance.md",
      "revision": "323a51777f6dabd97f0ff23e53f38acdb11abb02",
      "statements": [
        "DP030-DETAIL-265",
        "DP030-DETAIL-266",
        "DP030-DETAIL-267",
        "DP030-DETAIL-268",
        "DP030-DETAIL-269",
        "DP030-DETAIL-270",
        "DP030-DETAIL-271",
        "DP030-DETAIL-272",
        "DP030-DETAIL-273",
        "DP030-DETAIL-277"
      ]
    },
    {
      "doc_id": "DP-040",
      "path": "repo/proposals/assurance.md",
      "revision": "323a51777f6dabd97f0ff23e53f38acdb11abb02",
      "statements": [
        "DP040-DETAIL-206",
        "DP040-DETAIL-207",
        "DP040-DETAIL-210",
        "DP040-DETAIL-213"
      ]
    }
  ]
}
